<?xml version="1.0" encoding="UTF-8"?>
<xs:schema xmlns:xs="http://www.w3.org/2001/XMLSchema">

  <xs:element name="students">
    <xs:complexType>
      <xs:sequence>
        <xs:element name="student" maxOccurs="unbounded">
          <xs:complexType>
            <xs:sequence>
              <xs:element name="regNo" type="xs:string"/>
              <xs:element name="name" type="xs:string"/>
              <xs:element name="dob" type="xs:date"/>
              <xs:element name="mobile" type="xs:string"/>
              <xs:element name="email" type="xs:string"/>
              <xs:element name="course" type="xs:string"/>
              <xs:element name="year" type="xs:positiveInteger"/>
            </xs:sequence>
          </xs:complexType>
        </xs:element>
      </xs:sequence>
    </xs:complexType>
  </xs:element>

</xs:schema>
